<?xml version="1.0" encoding="UTF-8"?>
<ChasteParameters
       xmlns:xsi="http://www.w3.org/2001/XMLSchema-instance"
       xsi:noNamespaceSchemaLocation="../../src/io/ChasteParameters.xsd">

	<Simulation>
		<!-- 
			Problem definition 
		-->    
	    <SimulationDuration>10.0</SimulationDuration>
	    <Domain>Mono</Domain>
	    <IonicModel>FaberRudy2000Version3</IonicModel>
	    
		<!-- 
			Mesh definition 
		-->
		<Mesh>
			<LoadMesh name="foo" conductivity_media="NoFibreOrientation"/>    
	  	</Mesh>
	
	    <!-- 
	    	Stimuli (as many <Stimulus> definitions as needed) 
	   	-->
	   	<Stimuli>
		  	<Stimulus> <!-- #1 -->
				<Strength>-25500.0</Strength>
				<Duration>0.5</Duration>
				<Delay>0</Delay>
				<Location>
					<CornerA x="-5.0" z="-5.0" y="-0.125"/>
					<CornerB x="-4.75" z="5.0" y="0.125"/>
				</Location>
			</Stimulus>	
			<Stimulus> <!-- #2 -->
				<Strength>-25500.0</Strength>
				<Duration>0.5</Duration>
				<Delay>200.0</Delay>
				<Location>
					<CornerA x="-5.0" z="-5.0" y="-0.125"/>
					<CornerB x="0.0" z="0.0" y="0.125"/>
				</Location>
			</Stimulus>
	   	</Stimuli>		
		
		<!-- 
			Output 
		-->
		<OutputDirectory>ChasteResults</OutputDirectory>
	</Simulation>
	
	<Physiological>
	    <!--
	        Conductivities
	    -->
	    <IntracellularConductivities longi="1.75" trans="1.75" normal="1.75" />
	    <ExtracellularConductivities longi="7.0"  trans="7.0"  normal="7.0" />
	    <SurfaceAreaToVolumeRatio> 1400 </SurfaceAreaToVolumeRatio>
	    <Capacitance> 1.0 </Capacitance>
	</Physiological>

	<Numerical>
		<TimeSteps ode="0.01" pde="0.01" printing="0.01"/>
		<KSPTolerances>
			<KSPRelative>1e-6</KSPRelative>
		</KSPTolerances>
		<KSPSolver>gmres</KSPSolver>
		<KSPPreconditioner>ilu</KSPPreconditioner>
	</Numerical>
</ChasteParameters>
