<?xml version="1.0" encoding="UTF-8"?>
<ChasteParameters
       xmlns:xsi="http://www.w3.org/2001/XMLSchema-instance"
       xsi:noNamespaceSchemaLocation="../../src/io/ChasteParameters.xsd">
       
	<Simulation>
		<!-- 
			Problem definition 
		-->    
	    <SimulationDuration>10.0</SimulationDuration>
	    <Domain>Mono</Domain>
	    <IonicModel>FaberRudy2000Version3</IonicModel>
	    
		<!-- 
			Mesh definition 
		-->
		<Mesh>
			<Slab>    
		    	<SlabX>4.0</SlabX>
		    	<SlabY>0.1</SlabY>
		    	<SlabZ>2.0</SlabZ>
		    	<InterNodeSpace>0.1</InterNodeSpace>
	    	</Slab>
	  	</Mesh>
	
	    <!-- 
	    	Stimuli (as many <Stimulus> definitions as needed) 
	   	-->
	  	<Stimulus> <!-- #1 -->
			<Strength>-25500.0</Strength>
			<Duration>0.5</Duration>
			<Delay>0</Delay>
			<Location>
				<CornerA X="-5.0" Z="-5.0" Y="-0.125"/>
				<CornerB X="-4.75" Z="5.0" Y="0.125"/>
			</Location>
		</Stimulus>	
		<Stimulus> <!-- #2 -->
			<Strength>-25500.0</Strength>
			<Duration>0.5</Duration>
			<Delay>200.0</Delay>
			<Location>
				<CornerA X="-5.0" Z="-5.0" Y="-0.125"/>
				<CornerB X="0.0" Z="0.0" Y="0.125"/>
			</Location>
		</Stimulus>	
		
		<!-- 
			Output 
		-->
		<OutputDirectory>ChasteResults</OutputDirectory>
	    <MeshOutputDirectory>Slab</MeshOutputDirectory>	
	</Simulation>
	
	<Physiological>
	    <!--
	        Conductivities
	    -->
	    <IntracellularConductivities longi="1.75" trans="1.75" normal="1.75" />
	    <ExtracellularConductivities longi="7.0"  trans="7.0"  normal="7.0" />
	    <SurfaceAreaToVolumeRatio> 1400 </SurfaceAreaToVolumeRatio>
	    <Capacitance> 1.0 </Capacitance>
	</Physiological>

	<Numerical>
		<Timesteps ode="0.01" pde="0.01" printing="0.01"/>
		<KSPTolerances relative="1e-6" absolute="1e-50"/>
		<KSPSolver>gmres</KSPSolver>
		<KSPPreconditioner>ilu</KSPPreconditioner>
	</Numerical>

</ChasteParameters>
